title,text,subject,date,label
 Pope Francis Just Called Out Donald Trump During His Christmas Speech,pope francis used his annual christmas day message to rebuke donald trump without even mentioning his name the pope delivered his message just days after members of the united nations condemned trump s move to recognize jerusalem as the capital of israel the pontiff prayed on monday for the peaceful coexistence of two states within mutually agreed and internationally recognized borders we see jesus in the children of the middle east who continue to suffer because of growing tensions between israelis and palestinians francis said on this festive day let us ask the lord for peace for jerusalem and for all the holy land let us pray that the will to resume dialogue may prevail between the parties and that a negotiated solution can finally be reached the pope went on to plead for acceptance of refugees who have been forced from their homes and that is an issue trump continues to fight against francis used jesus for which there was no place in the inn as an analogy today as the winds of war are blowing in our world and an outdated model of development continues to produce human societal and environmental decline christmas invites us to focus on the sign of the child and to recognize him in the faces of little children especially those for whom like jesus there is no place in the inn he said jesus knows well the pain of not being welcomed and how hard it is not to have a place to lay one s head he added may our hearts not be closed as they were in the homes of bethlehem the pope said that mary and joseph were immigrants who struggled to find a safe place to stay in bethlehem they had to leave their people their home and their land francis said this was no comfortable or easy journey for a young couple about to have a child at heart they were full of hope and expectation because of the child about to be born yet their steps were weighed down by the uncertainties and dangers that attend those who have to leave their home behind so many other footsteps are hidden in the footsteps of joseph and mary francis said sunday we see the tracks of entire families forced to set out in our own day we see the tracks of millions of persons who do not choose to go away but driven from their land leave behind their dear ones amen to thatphoto by christopher furlonggetty images,News,"December 25, 2017",0
Senior U.S. Republican senator: 'Let Mr. Mueller do his job',washington reuters the special counsel investigation of links between russia and president trumps 2016 election campaign should continue without interference in 2018 despite calls from some trump administration allies and republican lawmakers to shut it down a prominent republican senator said on sunday lindsey graham who serves on the senate armed forces and judiciary committees said department of justice special counsel robert mueller needs to carry on with his russia investigation without political interference this investigation will go forward it will be an investigation conducted without political influence graham said on cbss face the nation news program and we all need to let mr mueller do his job i think hes the right guy at the right time the question of how russia may have interfered in the election and how trumps campaign may have had links with or coordinated any such effort has loomed over the white house since trump took office in january it shows no sign of receding as trump prepares for his second year in power despite intensified rhetoric from some trump allies in recent weeks accusing muellers team of bias against the republican president trump himself seemed to undercut his supporters in an interview last week with the new york times in which he said he expected mueller was going to be fair russias role in the election and the question of possible links to the trump campaign are the focus of multiple inquiries in washington three committees of the senate and the house of representatives are investigating as well as mueller whose team in may took over an earlier probe launched by the us federal bureau of investigation fbi several members of the trump campaign and administration have been convicted or indicted in the investigation trump and his allies deny any collusion with russia during the campaign and the kremlin has denied meddling in the election graham said he still wants an examination of the fbis use of a dossier on links between trump and russia that was compiled by a former british spy christopher steele which prompted trump allies and some republicans to question muellers inquiry on saturday the new york times reported that it was not that dossier that triggered an early fbi probe but a tip from former trump campaign foreign policy adviser george papadopoulos to an australian diplomat that russia had damaging information about former trump rival hillary clinton i want somebody to look at the way the department of justice used this dossier it bothers me greatly the way they used it and i want somebody to look at it graham said but he said the russia investigation must continue as a matter of fact it would hurt us if we ignored it he said,politicsNews,"December 31, 2017 ",1
" Trump Said Some INSANELY Racist Stuff Inside The Oval Office, And Witnesses Back It Up",in the wake of yet another court decision that derailed donald trump s plan to bar muslims from entering the united states the new york times published a report on saturday morning detailing the president s frustration at not getting his way and how far back that frustration goesaccording to the article back in june trump stomped into the oval office furious about the state of the travel ban which he thought would be implemented and fully in place by then instead he fumed visas had already been issued to immigrants at such a rate that his friends were calling to say he looked like a fool after making his broad pronouncementsit was then that trump began reading from a document that a top advisor noted white supremacist stephen miller had handed him just before the meeting with his cabinet the page listed how many visas had been issued this year and included 2500 from afghanistan a country not on the travel ban 15000 from haiti also not included and 40000 from nigeria sensing a pattern yet and trump expressed his dismay at eachaccording to witnesses in the room who spoke to the times on condition of anonymity and who were interviewed along with three dozen others for the article trump called out each country for its faults as he read afghanistan was a terrorist haven the people of nigeria would never go back to their huts once they saw the glory of america and immigrants from haiti all have aids despite the extensive research done by the newspaper the white house of course denies that any such language was usedbut given trump s racist history and his advisor stephen miller s blatant white nationalism it would be no surprise if a freedom of information act request turned up that the document in question had the statements printed inline as commentary for the president to punctuate his anger with it was miller after all who was responsible for the american carnage speech that trump delivered at his inaugurationthis racist is a menace to america and he doesn t represent anything that this country stands for let s hope that more indictments from robert mueller are on their way as we speakfeatured image via chris kleponispoolgetty images,News,"December 23, 2017",0
"As U.S. budget fight looms, Republicans flip their fiscal script",washington reuters the head of a conservative republican faction in the us congress who voted this month for a huge expansion of the national debt to pay for tax cuts called himself a fiscal conservative on sunday and urged budget restraint in 2018 in keeping with a sharp pivot under way among republicans us representative mark meadows speaking on cbs face the nation drew a hard line on federal spending which lawmakers are bracing to do battle over in january when they return from the holidays on wednesday lawmakers will begin trying to pass a federal budget in a fight likely to be linked to other issues such as immigration policy even as the november congressional election campaigns approach in which republicans will seek to keep control of congress president donald trump and his republicans want a big budget increase in military spending while democrats also want proportional increases for nondefense discretionary spending on programs that support education scientific research infrastructure public health and environmental protection the trump administration has already been willing to say were going to increase nondefense discretionary spending by about 7 percent meadows chairman of the small but influential house freedom caucus said on the program now democrats are saying thats not enough we need to give the government a pay raise of 10 to 11 percent for a fiscal conservative i dont see where the rationale is eventually you run out of other peoples money he said meadows was among republicans who voted in late december for their partys debtfinanced tax overhaul which is expected to balloon the federal budget deficit and add about 15 trillion over 10 years to the 20 trillion national debt its interesting to hear mark talk about fiscal responsibility democratic us representative joseph crowley said on cbs crowley said the republican tax bill would require the united states to borrow 15 trillion to be paid off by future generations to finance tax cuts for corporations and the rich this is one of the least fiscally responsible bills weve ever seen passed in the history of the house of representatives i think were going to be paying for this for many many years to come crowley said republicans insist the tax package the biggest us tax overhaul in more than 30 years will boost the economy and job growth house speaker paul ryan who also supported the tax bill recently went further than meadows making clear in a radio interview that welfare or entitlement reform as the party often calls it would be a top republican priority in 2018 in republican parlance entitlement programs mean food stamps housing assistance medicare and medicaid health insurance for the elderly poor and disabled as well as other programs created by washington to assist the needy democrats seized on ryans early december remarks saying they showed republicans would try to pay for their tax overhaul by seeking spending cuts for social programs but the goals of house republicans may have to take a back seat to the senate where the votes of some democrats will be needed to approve a budget and prevent a government shutdown democrats will use their leverage in the senate which republicans narrowly control to defend both discretionary nondefense programs and social spending while tackling the issue of the dreamers people brought illegally to the country as children trump in september put a march 2018 expiration date on the deferred action for childhood arrivals or daca program which protects the young immigrants from deportation and provides them with work permits the president has said in recent twitter messages he wants funding for his proposed mexican border wall and other immigration law changes in exchange for agreeing to help the dreamers representative debbie dingell told cbs she did not favor linking that issue to other policy objectives such as wall funding we need to do daca clean she said on wednesday trump aides will meet with congressional leaders to discuss those issues that will be followed by a weekend of strategy sessions for trump and republican leaders on jan 6 and 7 the white house said trump was also scheduled to meet on sunday with florida republican governor rick scott who wants more emergency aid the house has passed an 81 billion aid package after hurricanes in florida texas and puerto rico and wildfires in california the package far exceeded the 44 billion requested by the trump administration the senate has not yet voted on the aid,politicsNews,"December 31, 2017 ",1
Trump wants Postal Service to charge 'much more' for Amazon shipments,seattlewashington reuters president donald trump called on the us postal service on friday to charge much more to ship packages for amazon amzno picking another fight with an online retail giant he has criticized in the past why is the united states post office which is losing many billions of dollars a year while charging amazon and others so little to deliver their packages making amazon richer and the post office dumber and poorer should be charging much more trump wrote on twitter the presidents tweet drew fresh attention to the fragile finances of the postal service at a time when tens of millions of parcels have just been shipped all over the country for the holiday season the us postal service which runs at a big loss is an independent agency within the federal government and does not receive tax dollars for operating expenses according to its website package delivery has become an increasingly important part of its business as the internet has led to a sharp decline in the amount of firstclass letters the president does not determine postal rates they are set by the postal regulatory commission an independent government agency with commissioners selected by the president from both political parties that panel raised prices on packages by almost 2 percent in november amazon was founded by jeff bezos who remains the chief executive officer of the retail company and is the richest person in the world according to bloomberg news bezos also owns the washington post a newspaper trump has repeatedly railed against in his criticisms of the news media in tweets over the past year trump has said the amazon washington post fabricated stories he has said amazon does not pay sales tax which is not true and so hurts other retailers part of a pattern by the former businessman and reality television host of periodically turning his ire on big american companies since he took office in january daniel ives a research analyst at gbh insights said trumps comment could be taken as a warning to the retail giant however he said he was not concerned for amazon we do not see any price hikes in the future however that is a risk that amazon is clearly aware of and it is building out its distribution system aggressively he said amazon has shown interest in the past in shifting into its own delivery service including testing drones for deliveries in 2015 the company spent 115 billion on shipping 46 percent of its total operating expenses that year amazon shares were down 086 percent to 117590 by early afternoon overall us stock prices were down slightly on friday satish jindel president of shipmatrix inc which analyzes shipping data disputed the idea that the postal service charges less than united parcel service inc upsn and fedex corp fdxn the other biggest players in the parcel delivery business in the united states many customers get lower rates from ups and fedex than they would get from the post office for comparable services he said the postal service delivers about 62 percent of amazon packages for about 35 to 4 million a day during the current peak yearend holiday shipping season jindel said the seattlebased company and the post office have an agreement in which mail carriers take amazon packages on the last leg of their journeys from post offices to customers doorsteps amazons no 2 carrier is ups at 21 percent and fedex is third with 8 percent or so according to jindel trumps comment tapped into a debate over whether postal service pricing has kept pace with the rise of ecommerce which has flooded the mail with small packagesprivate companies like ups have long claimed the current system unfairly undercuts their business steve gaut a spokesman for ups noted that the company values its productive relationship with the postal service but that it has filed with the postal regulatory commission its concerns about the postal services methods for covering costs representatives for amazon the white house the us postal service and fedex declined comment or were not immediately available for comment on trumps tweet according to its annual report the postal service lost 274 billion this year and its deficit has ballooned to 6186 billion while the postal services revenue for first class mail marketing mail and periodicals is flat or declining revenue from package delivery is up 44 percent since 2014 to 195 billion in the fiscal year ended sept 30 2017 but it also lost about 2 billion in revenue when a temporary surcharge expired in april 2016 according to a government accountability office report in february the service is facing growing personnel expenses particularly 734 billion in unfunded pension and benefits liabilities the postal service has not announced any plans to cut costs by law the postal service has to set prices for package delivery to cover the costs attributable to that service but the postal service allocates only 55 percent of its total costs to its business of shipping packages even though that line of business is 28 percent of its total revenue,politicsNews,"December 29, 2017 ",1
" Fresh Off The Golf Course, Trump Lashes Out At FBI Deputy Director And James Comey",donald trump spent a good portion of his day at his golf club marking the 84th day he s done so since taking the oath of office it must have been a bad game because just after that trump lashed out at fbi deputy director andrew mccabe on twitter following a report saying mccabe plans to retire in a few months the report follows mccabe s testimony in front of congressional committees this week as well as mounting criticism from republicans regarding the russia probeso naturally trump attacked mccabe with a lie how can fbi deputy director andrew mccabe the man in charge along with leakin james comey of the phony hillary clinton investigation including her 33000 illegally deleted emails be given 700000 for wife s campaign by clinton puppets during investigation trump tweetedhow can fbi deputy director andrew mccabe the man in charge along with leakin james comey of the phony hillary clinton investigation including her 33000 illegally deleted emails be given 700000 for wife s campaign by clinton puppets during investigation donald j trump realdonaldtrump december 23 2017he didn t stop therefbi deputy director andrew mccabe is racing the clock to retire with full benefits 90 days to go donald j trump realdonaldtrump december 23 2017wow fbi lawyer james baker reassigned according to foxnews donald j trump realdonaldtrump december 23 2017with all of the intel at trump s disposal he s getting his information from fox news mccabe spent most of his career in the fight against terrorism and now he s being attacked by the socalled president trump has been factchecked before on his claim of his wife receiving 700000 for her campaignpolitifact noted in late july that trump s tweet about andrew mccabe is a significant distortion of the facts and the implication that mccabe got clinton off as a political favor doesn t make much sense when we look at the evidence his july tweet was rated mostly false but trump repeats these lies because he knows his supporters will believe them without bothering to google it s still a lie thoughphoto by zach gibson poolgetty images,News,"December 23, 2017",0
